monthYear,filename,x_network,y_network,component,class,walktrap_group,title,updated,entity,topic,winner,is_new,is_pick,subhead,related_suid,related_link,footnotes,overview,methodology,sources,data_updated,month,year,day,timeRow,timeCol,timeStack
5-2013,top-grossing-in-u-dot-s-movies.csv,0.1789951261439759,-5.842554298797974,2,2_261,28,Top-Grossing in U.S.: Movies,2013-05-29,other,business,Gone with the Wind,NA,NA,"Adjusted for ticket-price inflation, Gone with the Wind was the highest grossing film in U.S. history.",NA,NA,NA,Bloomberg ranked the 20 domestic top-grossing U.S. films by U.S. box-office receipts adjusted for ticket-price inflation.,Adjusted gross receipts for all releases were calculated by multiplying estimated admissions of each film by the 2013 average ticket price of $7.94.,IMDb/Box Office Mojo,2013-05-29,5,2013,29,1,10,19
5-2013,fastest-growing-moving-destinations-us-cities.csv,1.4327233537038673,2.3176139148455364,2,2_261,3,Fastest-Growing Moving Destinations: U.S. Cities,2013-05-30,places,business,"San Francisco, CA",NA,NA,San Francisco is the fastest-growing moving destination over the last two years,NA,NA,NA,Bloomberg ranked cities based on the average percentage growth of inbound moves in 2011 and  2012. Move-in growth shows the percentage by which moves into the city exceeded moves out of the city.,Average growth is the geometric mean of the 2011 and 2012 growth percentages. Only cities among the top 30 cities for growth in both years were included.,"Bloomberg, U-Haul",2013-05-30,5,2013,30,2,10,20
5-2013,most-overpaid-in-banking-industry-ceos.csv,-8.653014615622933,1.2279091715459196,2,2_261,4,Most Overpaid in Banking Industry: CEOs,2013-05-31,people,business,Richard Fairbank,NA,NA,Richard Fairbank and Lloyd Blankfein were paid too much in 2012 based on their performance,NA,NA,NA,Bloomberg ranked the 20 biggest North American banks by assets on whether their CEOs were overcompensated or undercompensated.,"First, the banks were ranked on three different measures to assess their results and size as of the end of each company's 2012 fiscal year: stock performance, return on common equity, and total assets, including cash and investments. Then the average of the share performance, ROE and asset scores for each bank were calculated to establish an average rank for them. Each CEO's compensation standing was subtracted from his or her bank's average rank. (Total compensation includes salaries, stock awards, bonuses and long-term incentive awards given to CEOs for their performance in 2012, which is not always the same as the figures that appear in proxies' Summary Compensation Tables.) The CEOs with the biggest difference between the two rankings were regarded as the most overcompensated.","Bloomberg, companies",2013-05-31,5,2013,31,1,11,21
6-2013,top-selling-contemporary-female-artists.csv,2.3472496659786475,-3.0476891702487845,2,2_261,12,Top-Selling Contemporary: Female Artists,2013-06-03,people,investing,Yayoi Kusama,NA,NA,Sale prices of Yayoi Kusama's works are up an average of 880% since 2002,NA,NA,NA,"Bloomberg ranked living women artists based on sales of works at auction from 1985 through May 31, 2013.","Sales included buyers' premiums. Dual nationality artists, or those born in one country who spent most of their working life in another, are noted.",Artnet,2013-06-03,6,2013,3,1,1,1
6-2013,top-20-by-revenue-worldwide-companies.csv,-3.5410812037284716,-0.78930335087415,2,2_261,4,Top 20 by Revenue Worldwide: Companies,2013-06-04,companies,business,Wal-Mart Stores,NA,NA,Integrated-oil companies account for seven of the world's top 10 ranked by revenue,NA,NA,NA,"Bloomberg ranked 67,260 publicly listed companies based on revenue for their latest fiscal year. The top 20 are displayed.","For all companies on this list except Wal-Mart Stores, which reported 2013 results, figures are for 2012. Revenues shown for Glencore Xtrada are for Glencore International.",Bloomberg,2013-06-04,6,2013,4,2,1,2
6-2013,top-20-by-profits-in-u-dot-s-companies.csv,-4.371812880199868,0.1446351449235881,2,2_261,4,Top 20 by Profits in U.S.: Companies,2013-06-04,companies,business,Exxon Mobil,NA,NA,"Apple is more profitable than Microsoft and IBM combined, Exxon Mobil is #1",NA,NA,NA,"Bloomberg ranked 3,778 publicly listed U.S.-domiciled companies based on net income for their latest fiscal year.","Data for all companies listed except for Wal-Mart, which reported 2013 results, are for 2012.",Bloomberg,2013-06-04,6,2013,4,1,2,3
6-2013,top-20-by-revenue-in-u-dot-s-companies.csv,-3.895144668844996,0.3953056567386547,2,2_261,4,Top 20 by Revenue in U.S.: Companies,2013-06-04,companies,business,Wal-Mart Stores,NA,NA,Revenue for top-ranked Wal-Mart is more than double that of third-place Chevron,NA,NA,NA,"Bloomberg ranked 3,778 publicly traded U.S.-domiciled companies based on revenue for their latest fiscal year.","Data for all companies listed except for Wal-Mart and McKesson, which reported 2013 results, are for 2012.",Bloomberg,2013-06-04,6,2013,4,2,2,4
6-2013,lowest-ratio-of-obesity-to-health-coaches-states.csv,-13.671698341927863,4.227862751187394,2,2_261,11,Lowest Ratio of Obesity to Health Coaches: States,2013-06-05,places,lifestyle,Massachusetts,NA,NA,"In general, states with lower levels of obesity have the most help maintaining a healthy lifestyle",NA,NA,NA,"Bloomberg ranked the U.S. states and the District of Columbia on the gap between the concentration of obese adults and the concentration of ""health coaches"": lifestyle-promoting professionals including dietitians, nutritionists, fitness trainers and aerobics instructors.",The Health gap is the (adjusted) percentage-point difference between the concentration of obese adults and health coaches. Numbers for the latter professions were extracted from the Bureau of Labor Statistics Occupational Employment Statistics and aggregated. Self-employed workers were excluded from the OES survey. Data are most recently available.,"Centers for Disease Control and Prevention, U.S. Bureau of Labor Statistics",2013-06-05,6,2013,5,1,3,5
6-2013,getting-fatter-fastest-states.csv,-13.74127339560325,3.6214374189622394,2,2_261,11,Getting Fatter Fastest: States,2013-06-05,places,lifestyle,Delaware,NA,NA,Delaware residents have shown the greatest increase in adult obesity,NA,NA,NA,Bloomberg ranked the U.S. states and the District of Columbia based on the growth in numbers of obese adults from 2000 to 2011.,Figures on obesity were obtained from telephone interviews conducted by the Centers for Disease Control and Prevention; 2011 data included mobile phone users while previous years included only landline telephone users.,"Centers for Disease Control and Prevention, U.S. Census Bureau",2013-06-05,6,2013,5,2,3,6
6-2013,highest-concentration-of-arts-majors-states.csv,-0.8196392597233373,7.6708640697002215,2,2_261,3,Highest Concentration of Arts Majors: States,2013-06-06,places,education,New York,NA,NA,"New York has highest concentration of visual/performing arts majors, the lowest-paying college major",NA,NA,NA,Bloomberg ranked the U.S. states and the District of Columbia based on the percentage of the population ages 25 and older with a visual and performing arts degree.,Percentages were calculated by identifying residents over the age of 25 who received Bachelor's degrees in visual and performing arts.,U.S. Census 2011 ACS 3-Year Estimates,2013-06-06,6,2013,6,1,4,7
6-2013,highest-concentration-of-engineering-majors-states.csv,-0.560492414858703,6.40175473717539,2,2_261,3,Highest Concentration of Engineering Majors: States,2013-06-06,places,education,Michigan,NA,NA,"Michigan has the highest percentage of people who studied engineering, the best-paying college major",NA,NA,NA,Bloomberg ranked the U.S. states and the District of Columbia based on the percentage of the population age 25 and older who have engineering degrees.,Percentages were calculated by identifying residents over the age of 25 who received Bachelor's degrees in engineering.,U.S. Census 2011 ACS 3-Year Estimates,2013-06-06,6,2013,6,2,4,8
6-2013,highest-pay-for-an-advanced-college-degree-jobs.csv,0.7043831959808708,9.745236523521115,2,2_261,20,Highest Pay for an Advanced College Degree: Jobs,2013-06-07,careers,personal-finance,Anesthesiologists,NA,NA,Anesthesiologists top the chart for highest earnings in professions requiring advanced degrees,NA,NA,NA,Bloomberg ranked the median annual pay of occupations held by individuals with advanced degrees. The 20 highest-paying jobs at each educational level were listed.,"Excluded were occupations with fewer than10,000 jobs nationwide or lacking sufficient data. Pay includes base rate, cost-of-living allowances, guaranteed pay, hazardous-duty pay and incentive pay, including commissions, production bonuses and tips. For the five best-paid jobs in the advanced degree category, median pay figures were not available and mean annual pay figures were used. Data were released in April 2013 for the year 2012.","U.S. Bureau of Labor Statistics, Education-Portal.com",2013-06-07,6,2013,7,1,5,9
6-2013,highest-pay-for-a-bachelors-degree-jobs.csv,0.24141815701321956,7.505314031160024,2,2_261,3,Highest Pay for a Bachelor's Degree: Jobs,2013-06-07,careers,personal-finance,Chief Executives,NA,NA,Chief executives make the most among professional in jobs that don't require advanced degrees,NA,NA,NA,Bloomberg ranked the median annual pay for jobs held by individuals with bachelor's degrees. The 20 highest-paying jobs were listed.,"Excluded were occupations with fewer than10,000 jobs nationwide or lacking sufficient data. Pay includes base rate, cost-of-living allowances, guaranteed pay, hazardous-duty pay and incentive pay, including commissions, production bonuses and tips. Data were released in April 2013 for the year 2012.","U.S. Bureau of Labor Statistics, Education-Portal.com",2013-06-07,6,2013,7,2,5,10
6-2013,highest-pay-for-a-high-school-diploma-jobs.csv,-0.10135158267501479,9.881981254628224,2,2_261,20,Highest Pay for a High School Diploma: Jobs,2013-06-07,careers,personal-finance,Managers,NA,NA,Managers lacking a college diploma still make six figures,NA,NA,NA,Bloomberg ranked the median annual pay of occupations held by individuals with a high school diploma. The 20 highest-paying jobs were listed.,"Excluded were occupations with fewer than 10,000 jobs nationwide or lacking sufficient data. Pay includes base rate, cost-of-living allowances, guaranteed pay, hazardous-duty pay and incentive pay, including commissions, production bonuses and tips.  Data were released in April 2013 for the year 2012.","U.S. Bureau of Labor Statistics, Education-Portal.com",2013-06-07,6,2013,7,1,6,11
6-2013,highest-pay-for-some-college-jobs.csv,-0.21321146175327726,8.681791405510692,2,2_261,20,Highest Pay for Some College: Jobs,2013-06-07,careers,personal-finance,Air Traffic Controllers,NA,NA,Air traffic controllers can earn six figures even without a four-year degree,NA,NA,NA,Bloomberg ranked the median annual pay of occupations held by individuals with some college experience. The 20 highest-paying jobs were listed.,"Excluded were occupations with fewer than 10,000 jobs nationwide or lacking sufficient data. Pay includes base rate, cost-of-living allowances, guaranteed pay, hazardous-duty pay and incentive pay, including commissions, production bonuses and tips. ""Some college"" includes occupations with the following minimum educational requirements: associate's degree, some college but no degree and/or postsecondary nondegree programs.  Data were released in April 2013 for the year 2012.","U.S. Bureau of Labor Statistics, Education-Portal.com",2013-06-07,6,2013,7,2,6,12
6-2013,highest-pay-without-a-high-school-diploma-jobs.csv,0.20224743240287638,9.870604622562919,2,2_261,20,Highest Pay without a High School Diploma: Jobs,2013-06-07,careers,personal-finance,Mine Shuttle Car Operators,NA,NA,No high school diploma? You can still make a decent living as a mine shuttle car operator,NA,NA,NA,Bloomberg ranked the median annual pay of occupations held by individuals without a high school diploma. The 20 highest-paying jobs were listed.,"Excluded were occupations with fewer than10,000 jobs nationwide or lacking sufficient data. Pay includes base rate, cost-of-living allowances, guaranteed pay, hazardous-duty pay and incentive pay, including commissions, production bonuses and tips. Data were released in April 2013 for the year 2012.","U.S. Bureau of Labor Statistics, Education-Portal.com",2013-06-07,6,2013,7,1,7,13
6-2013,greatest-decrease-in-marriages-states.csv,2.6800147988836778,5.975627970457132,2,2_261,6,Greatest Decrease in Marriages: States,2013-06-10,places,lifestyle,Tennessee,NA,NA,Tennessee has seen the most precipitous drop in marriages over the last decade,NA,NA,NA,Bloomberg ranked U.S. states and the District of Columbia on the change in marriage rate from 2001 to 2011.,"Included were the marriages per 1,000 residents from 2002 to 2011. Data were not available for Oklahoma prior to 2004 and for Louisiana in 2006. Nevada and Hawaii were excluded due to unusually high marriage rates, presumably because of their popularity for ""destination"" weddings.",Centers for Disease Control and Prevention,2013-06-10,6,2013,10,2,7,14
6-2013,top-20-by-profits-worldwide-companies.csv,-4.260580740966722,-0.4383125830945495,2,2_261,4,Top 20 by Profits Worldwide: Companies,2013-06-11,companies,business,Exxon Mobil,NA,NA,Banks and integrated-oil companies dominate the list of 20 most profitable companies in the world,NA,NA,NA,"Bloomberg ranked 67,260 publicly listed companies based on net income for their latest fiscal year. The top 20 are displayed.",Figures are for 2012 except for Wal-Mart which has reported 2013 results. BHP Billiton is a dually-listed company with BLT LN.,Bloomberg,2013-06-11,6,2013,11,1,8,15
6-2013,most-educated-states.csv,1.4011820020538397,4.002608911297162,2,2_261,3,Most Educated: States,2013-06-11,places,education,District of Columbia,NA,NA,DC residents hold almost double the number of advanced degrees of any state,NA,NA,NA,Bloomberg ranked the U.S. states and the District of Columbia based on their populations' levels of education.,States are ranked on the percentage of the population aged 25+ with bachelor's degrees or higher.,U.S. Census Bureau  2011 American Community Survey 1-Year Estimates,2013-06-11,6,2013,11,2,8,16
6-2013,biggest-oil-producers-countries.csv,-1.398454370395361,4.757519679826966,2,2_261,5,Biggest Oil Producers: Countries,2013-06-12,places,business,Russia,NA,NA,"Russia and Saudi Arabia are neck-and-neck for top oil production, with the U.S. a distant third",NA,NA,NA,Bloomberg ranked countries based on their average daily oil production in 2012.,The 20 largest producers are displayed.,U.S. Energy Information Administration,2013-06-12,6,2013,12,1,9,17
6-2013,highest-youth-unemployment-countries.csv,-1.2408063609526307,1.5520555723360034,2,2_261,5,Highest Youth Unemployment: Countries,2013-06-12,places,economics,Greece,NA,TRUE,"In Greece and Spain, more than half of the labor force aged 15-25 is out of work",NA,NA,NA,"Bloomberg ranked 32 countries, including the 28 countries of the European Union plus Japan, Norway, Turkey and the U.S. based on the unemployment rate for the population age 15-25.","Figures are the latest annual average for 2012, not seasonally adjusted, updated as of May 31, 2013. The rate doesn't include people studying full-time or those who are neither working nor looking for a job. They are not part of the labor force which is used as the denominator for calculating the unemployment rate.",Eurostat,2013-06-12,6,2013,12,2,9,18
6-2013,greatest-growth-in-car-sales-worldwide-companies.csv,-3.6649601695455534,-2.2973346893591167,2,2_261,4,Greatest Growth in Car Sales Worldwide: Companies,2013-06-14,companies,business,Great Wall Motor,NA,NA,"Great Wall Motor posts a 42% five-year growth rate in car sales, nearly double its closest rival",NA,NA,NA,Bloomberg ranked the world's automakers by their growth from 2007 to 2012.,"Growth was measured using compound annual growth rate. Only manufacturers of at least 500,000 vehicles with data for 2012 are shown. The 2007 data for Chrysler Group were before its reorganization and the 2007 General Motors data were prebankruptcy. Data for Renault-Nissan Group and Fiat-Chrysler were broken out by manufacturing unit due to missing data for 2012 and 2007, respectively.",Bloomberg Industries,2013-06-14,6,2013,14,1,10,19
6-2013,greatest-increase-in-vehicle-sales-countries.csv,-0.24456984419034372,-2.923089051794734,2,2_261,10,Greatest Increase in Vehicle Sales: Countries,2013-06-14,places,business,Indonesia,NA,NA,Emerging-markets countries are showing the greatest increase in vehicle sales,NA,NA,NA,"Bloomberg ranked 37 countries with sales of 100,000 or more vehicles in 2007 and 2012 based on the change in sales during  that five-year period.","Ranks were determined by countries' compound annual growth rate. Vehicles in ranking include passenger cars, and may include light trucks, trucks, buses and other locally defined vehicles. World statistics are for passenger cars and light trucks.",Bloomberg Industries,2013-06-14,6,2013,14,2,10,20
6-2013,most-foreclosures-us-cities.csv,0.03809427729532714,0.7627147104694666,2,2_261,3,Most Foreclosures: U.S. Cities,2013-06-17,places,economics,"Miami, FL",NA,NA,Miami has the most foreclosures; the District of Columbia and New York City have the fewest,NA,NA,NA,"Bloomberg ranked the 76 U.S. cities with at least 250,000 residents as of 2012 based on the number of homes in any stage of foreclosure as of May 2013.","Rates were per 1,000 homes. Data were rounded.",RealtyTrac,2013-06-17,6,2013,17,1,11,21
6-2013,least-expensive-housing-markets-us-cities.csv,-0.23523502538506677,-1.6557901879161245,2,2_261,3,Least Expensive Housing Markets: U.S. Cities,2013-06-24,places,economics,"Ocala, FL",NA,NA,"Ocala, FL and Rockford, IL top the list for least expensive housing as of May 2013",NA,NA,NA,Bloomberg ranked U.S. cities for which data were available based on median home sale price in May 2013.,Data were for sales of all residential property types within the metro areas in which the cities are located.,Zillow,2013-06-24,6,2013,24,2,11,22
6-2013,most-expensive-housing-markets-us-cities.csv,0.01647391508398466,-0.9703894565450476,2,2_261,3,Most Expensive Housing Markets: U.S. Cities,2013-06-24,places,economics,"San Jose, CA",NA,NA,California has 12 of the 20 priciest housing markets,NA,NA,NA,Bloomberg ranked U.S. cities for which data were available based on median home sale price in May 2013.,Data were for sales of all residential property types within the metro areas in which the cities are located.,Zillow,2013-06-24,6,2013,24,1,12,23
6-2013,highest-obesity-inequality-slash-females-countries.csv,-12.556586805654979,3.8811157938183873,2,2_261,11,Highest Obesity Inequality/Females: Countries,2013-06-25,places,lifestyle,Bangladesh,NA,NA,Bangladesh has the largest ratio of underweight women to obese women in the world,NA,NA,NA,Bloomberg ranked countries based on the number of underweight women for every woman who is obese.,"The 20 countries with the greatest disparity, calculated by dividing the percentage of underweight women by the percentage of obese women, are shown. Excluded were countries with fewer than 10 million female adults or those lacking sufficient data. Data were most recent available. Body Mass Index (BMI) is an index of weight-to-height used to classify underweight, overweight and obesity in adults. BMI classification: Underweight <18.5, Normal: 18.5 to 24.99, Overweight: 25 to 29.9, Obese: 30+.","World Health Organization, United Nations Population Division",2013-06-25,6,2013,25,2,12,24
6-2013,highest-obesity-inequality-slash-males-countries.csv,-12.506160851163948,3.6140229939881467,2,2_261,11,Highest Obesity Inequality/Males: Countries,2013-06-25,places,lifestyle,Ethiopia,NA,NA,Ethiopia has the largest ratio of underweight men to obese men in the world,NA,NA,NA,Bloomberg ranked countries based on the number of underweight men for every man who is obese.,"The 20 countries with the greatest disparity, calculated by dividing the percentage of underweight men by the percentage of obese men, are shown. Excluded were countries with fewer than 10 million male adults or those lacking sufficient data. Data were most recent available. Body Mass Index (BMI) is an index of weight-to-height used to classify underweight, overweight and obesity in adults. BMI classification: Underweight <18.5, Normal: 18.5 to 24.99, Overweight: 25 to 29.9, Obese: 30+.","World Health Organization, United Nations Population Division",2013-06-25,6,2013,25,1,13,25
6-2013,most-assets-in-u-dot-s-banks.csv,-10.261729983934726,7.34311857146123,2,2_261,24,Most Assets in U.S.: Banks,2013-06-25,companies,economics,JPMorgan Chase,NA,NA,JPMorgan and Bank of America have combined total assets of nearly $4.6 trillion,NA,NA,NA,"Bloomberg ranked 1,377 U.S. banks and institutional financial services companies by latest available total assets and identified the top 25.",All data were as of the first quarter of 2013. Security and commodity exchanges were excluded.,Bloomberg,2013-06-25,6,2013,25,2,13,26
6-2013,biggest-prime-workforce-states.csv,3.8262484373878305,2.6708441700513963,2,2_261,8,Biggest Prime Workforce: States,2013-06-26,places,economics,District of Columbia,NA,NA,District of Columbia has the highest percentage of 25-to-44 year-old residents; Maine the lowest,NA,NA,NA,"Bloomberg ranked the U.S. states and the District of Columbia by the percentage of 25-to-44 year-olds in their population, a proxy for the concentration of prime workforce.","Population data were as of 2011, the latest available.",U.S. Census Bureau 2011 American Community Survey 1-Year Estimates,2013-06-26,6,2013,26,1,14,27
6-2013,highest-concentration-of-restaurants-states.csv,5.104900499013442,3.5524824411885167,2,2_261,8,Highest Concentration of Restaurants: States,2013-06-26,places,business,District of Columbia,NA,NA,"District of Columbia and Hawaii have the most restaurants per 1,000 households",NA,NA,NA,"Bloomberg ranked the U.S. states and the District of Columbia based on restaurant concentration, defined as the number of eating and drinking establishments per 1,000 households.","Restaurant data and household data were as of 2011, the latest available.","National Restaurant Association, U.S. Census Bureau",2013-06-26,6,2013,26,2,14,28
6-2013,most-financial-aid-colleges.csv,-7.199648650036892,3.8519314205728983,2,2_261,23,Most Financial Aid: Colleges,2013-06-27,schools,education,Boston University,NA,NA,Boston University provides greatest amount of financial aid though only 55% of students who apply get it,NA,NA,NA,Bloomberg ranked the top 50 U.S. colleges and universities based on institutional grant aid they provided to full-time first-time undergraduates.,"Included were 1,941 public and private not-for profit schools of four years or more. Schools were listed by campus if there was more than one campus. Total grant aid included institutional, federal and state/local grants. Data were for the most recently available school year.","U.S. Department of Education, National Center for Education Statistics, Integrated Postsecondary Education Data System (IPEDS), 2010-2011 data, Student Financial Aid component (final release)",2013-06-27,6,2013,27,1,15,29
6-2013,highest-unemployment-countries.csv,-1.3070558030378396,3.17809817377561,2,2_261,5,Highest Unemployment: Countries,2013-06-28,places,economics,Greece,NA,NA,"Four countries have jobless rates higher than 20%: Greece, Spain, South Africa and Nigeria",NA,NA,NA,"Bloomberg ranked 70 countries and the euro zone based on the latest unemployment rates reported through June 28, 2013.",Figures for Kazakhstan and Vietnam are from the IMF.  Figures are rounded.,"Bloomberg, International Monetary Fund",2013-06-28,6,2013,28,2,15,30
7-2013,biggest-increase-in-beer-consumption-states.csv,5.409858202628191,0.2590953232950371,2,2_261,8,Biggest Increase in Beer Consumption: States,2013-07-02,places,business,North Dakota,NA,NA,The Peace Garden State -- North Dakota -- increased beer consumption most from 2011 to 2012,NA,NA,NA,Bloomberg ranked the U.S. states and the District of Columbia based on change in consumption of beer from 2011 to 2012 .,Data were for per capita consumption of beer in 2012 and 2011 for residents ages 21 and older.,Beer Institute; Alcohol and Tobacco Tax and Trade Bureau; U.S. Census Bureau,2013-07-02,7,2013,2,1,1,1
7-2013,most-beer-consumption-2012-states.csv,4.89953629623678,0.870649984463954,2,2_261,8,Most Beer Consumption 2012: States,2013-07-02,places,business,North Dakota,NA,NA,The Peace Garden State -- North Dakota -- ranks first in beer consumption,NA,NA,NA,Bloomberg ranked the U.S. states and the District of Columbia based on per capita consumption of beer in 2012 for residents ages 21 and older,Change in consumption was calculated for the five years from 2007-2012.,Beer Institute; Alcohol and Tobacco Tax and Trade Bureau; U.S. Census Bureau,2013-07-02,7,2013,2,2,1,2
7-2013,longest-life-span-in-e-europe-slash-central-asia-countries.csv,7.29991329234846,3.5480015223974113,2,2_261,2,Longest Life Span in E. Europe/Central Asia: Countries,2013-07-02,places,lifestyle,Slovenia,NA,NA,The lifespan in Afghanistan is the shortest of Eastern Europe and Central Asia,NA,NA,NA,Bloomberg ranked countries in Eastern Europe and Central Asia based on life expectancy.,Life expectancy is defined as the number of years a newborn infant is expected to live assuming that age-specific mortality levels are constant.,World Bank,2013-07-02,7,2013,2,1,2,3
